essay,error,message,category,frase
2,REPEATED_WORDS_3X,"Para melhorar o texto, procure variar mais os termos utilizados.",REPETITIONS,"Chega-se a conclusão que tem que haver uma harmonia entre a liberdade de expressão e a intimidade, para que se possa ter um país no qual a lei deva ser usada de maneira efetiva e trazer benefícios, em vez de confusão, não há de se falar em desrespeito ao liberdade de expressão, quando na verdade o objetivo da lei e trazer melhora, a Constituição não é uma ciência exata, mas para ser efetiva o equilíbrio é fundamental, liberdade com freio não é censura, mas sim harmonia"
33,PORTUGUESE_WORD_REPEAT_RULE,Possível erro de escrita: você repetiu uma palavra,REPETITIONS,"O costume de sermos injusto nós faz termos alto-piedade,em em vez de praticarmos a verdadeira justiça, não fazemos e julgamos as pessoas que não a fazem, e esse ato nos torna hipócrita , e a nossa grande verdade é se liberta de um mal maior quando praticamos algo errado, isso porque a justiça é uma cura moral"
216,PHRASE_REPETITION,"Este segmento está duplicado. Talvez queira, apenas, dizer “de mais”.",REPETITIONS," E em pouco tempo uma pílula azul e branca esta causando uma disputa pela sua liberação, entre cientistas e políticos?A descoberta da fosfoetanolanina para o câncer foi feita pelo professor Gilberto chierice um estudo de mais de mais de 20 anos"
775,PORTUGUESE_WORD_REPEAT_BEGINNING_RULE,Três frases seguidas começam com a mesma palavra. Considere reformular a frase ou use um dicionário para encontrar um sinônimo.,REPETITIONS,"Podemos perguntar a esses indivíduos que estão puramente movidos a ganhar dinheiro,  “Imagine se seus pais, irmãos ou até filhos tiverem que conviver todos os dias com um livro acusando familiares queridos por tempo indeterminado, ”Ha quem diga ah e o motivo informar o mundo sobre a história do seu povo, eu posso argumentar o seguinte: de quem estamos falando? De um politico famoso? De um idolo que mudou a história? De uma pessoa relevante a história do país? Pois bem, se estamos falando de tais pessoas, então que estas biografias sejam feitas postumas , para preservar seus familiares"
1684,CONJUNCTION_REPETITION,Repetição gramaticalmente incorreta.,REPETITIONS,É importante também frisar também que ruas e calçadas estejam em boas condições para essa nova sociedade
